pubmed_id,title,abstract,authors,journal,publication_date,doi,fulltext_link,pmcid,access,updated_title,pdf_file,suggested_tags,webscraped_date,status,keywords
40376780,Aortic Valve Calcium Score Quantification by Contrast Cardiac CT: Correlations With Echocardiography and Optimal Thresholds.,"BACKGROUND: Aortic valve calcium score (AVCa) measured on noncontrast computed tomography (CT) is well-established for grading aortic stenosis (AS) severity. However, thresholds for AVCa measured on contrast CT remain uncertain. We evaluated correlations, associated factors, and severity thresholds of AVCa measured on contrast CT against transthoracic echocardiography (TTE) measures of AS.
METHODS: Patients with native AS undergoing transcatheter aortic valve replacement evaluation from 2019 to 2020 who underwent TTE and contrast-enhanced CT were retrospectively studied (n=1035, age 79±9 years, 429 (41.5%) women, 906 (87.5%) severe and 129 (12.5%) moderate AS by TTE). AVCa was measured using the modified Agatston method with the minimum threshold of 4 SD above the mean ascending aorta blood pool Hounsfield units. Receiver-operating characteristics analysis and Youden index were used to define sex-specific optimal AVCa thresholds for identifying severe AS defined by TTE (aortic valve area by continuity equation ≤1.0 cm2) in the derivation cohort and assessed when applied to the validation cohort.
RESULTS: Mean aortic valve area on TTE was 0.79±0.21 cm2, while mean AVCa score, volume, and mass were 2152±1102 modified AU, 1853±1592 mm3, and 673±485 mg, respectively. Multivariable linear regression identified women to be associated with lower AVCa (β-coefficient, -358), while chronic kidney disease was associated with a higher AVCa (β-coefficient, 171). Optimal severe AS thresholds of ≥1840 modified AU for men and ≥1430 modified AU for women were determined, with area under curve (95% CIs) and sensitivities/specificities of 0.809 (0.749-0.869, 71.3%, 82.2%) for men and 0.822 (0.751-0.892), 73.4%/78.9% for women in the derivation cohort, and 0.830 (0.786-0.875), 75.9%/87.5% for men and 0.780 (0.670-0.890), 77.5%/71.4% for women in the validation cohort.
CONCLUSIONS: AVCa by contrast CT is a useful tool for identifying severe AS by TTE, with sex-specific thresholds for severe AS identified. Further studies are necessary to externally validate our findings and evaluate their prognostic significance.","['Tiffany Dong', 'Elio Haroun', 'Aro Daniela Arockiam', 'Rishabh Khurana', 'Joseph El Dahdah', 'Ankit Agrawal', 'Yuichiro Okushi', 'David Moros', 'Kashyap Bodi', 'Ushasi Saraswati', 'Mohammad Alamer', 'Abdelrahman Abushouk', 'Agam Bansal', 'Serge Harb', 'Zoran Popovic', 'Leonardo Rodriguez', 'Rishi Puri', 'Grant Reed', 'Amar Krishnaswamy', 'Brian Griffin', 'Samir Kapadia', 'Tom Kai Ming Wang']",Circulation. Cardiovascular imaging,2025-05-16,10.1161/CIRCIMAGING.124.017373,https://doi.org/10.1161/CIRCIMAGING.124.017373,,Paid,Aortic Valve Calcium Score Quantification by Contrast Cardiac CT Correlations With Echocardiography and Optimal Thresholds DONG 2025,Not available,"['Calcium Score Quantification', 'Valve Calcium Score', 'Aortic Valve Calcium', 'Score Quantification', 'Calcium Score', 'Contrast Cardiac', 'Aortic Valve', 'Valve Calcium', 'aortic valve area', 'TTE']",2025-05-27,Pending,"['aortic valve', 'calcium', 'humans', 'linear models', 'prognosis']"
40375767,Leaflet modification techniques to mitigate coronary obstruction risk during transcatheter aortic valve implantation.,"Coronary obstruction is a rare but serious complication during transcatheter aortic valve implantation (TAVI), particularly in valve-in-valve procedures, which is associated with high mortality. This review explores various leaflet modification techniques designed to mitigate this risk. Among the most studied methods is Bioprosthetic or native Aortic Scallop Intentional Laceration to prevent Iatrogenic Coronary Artery obstruction (BASILICA), which uses transcatheter electrosurgery to lacerate the aortic valve leaflet and maintain coronary perfusion. Other promising techniques include ShortCut, a mechanical leaflet splitting device, and Undermining Iatrogenic Coronary Obstruction with Radiofrequency Needle (UNICORN), which utilises radiofrequency energy to achieve leaflet laceration. These approaches differ in their procedural complexity, equipment requirements, and clinical outcomes. Each technique's efficacy in preventing coronary obstruction is discussed, alongside the potential complications and the procedural challenges encountered in both native aortic valve and valve-in-valve settings. This review also highlights the importance of careful patient selection, advanced imaging techniques, and the need for further research to optimise these strategies.","['Sunny Goel', 'Richard Tanner', 'Kwong-Yue Eric Chan', 'Jaffar M Khan', 'Manish Vinayak', 'Stamatios Lerakis', 'Lucy M Safi', 'Sahil Khera', 'Parasuram Krishnamoorthy', 'Annapoorna S Kini', 'Samin K Sharma', 'George D Dangas', 'Gilbert H L Tang']",EuroIntervention : journal of EuroPCR in collaboration with the Working Group on Interventional Cardiology of the European Society of Cardiology,2025-05-16,10.4244/EIJ-D-24-00972,https://doi.org/10.4244/EIJ-D-24-00972,PMC12063549,Paid,Leaflet modification techniques to mitigate coronary obstruction risk during transcatheter aortic valve implantation GOEL 2025,Not downloaded,"['aortic valve implantation', 'transcatheter aortic valve', 'aortic valve', 'coronary obstruction', 'valve implantation', 'Aortic Scallop Intentional', 'coronary', 'aortic', 'Iatrogenic Coronary Artery', 'transcatheter aortic']",2025-05-27,Pending,[]
40375761,Long-term structural valve deterioration after TAVI: insights from the EORP ESC Valve Durability TAVI Registry.,"BACKGROUND: Valve durability is a key consideration as the patient population eligible for transcatheter aortic valve implantation (TAVI) expands to include lower-risk and younger individuals who are expected to live many years after the procedure.
AIMS: This registry aimed to assess the incidence of long-term structural valve deterioration (SVD) beyond 5 years post-TAVI.
METHODS: Consecutive living patients who underwent TAVI up until 2014 using any commercially available transcatheter heart valve (THV) at 22 participant centres were enrolled in the European Valve Durability TAVI Registry. All patients underwent comprehensive echocardiographic assessments (61% were evaluated independently by a central core laboratory) within 6 months of enrolment and at least 5 years post-TAVI; SVD was defined according to Valve Academic Research Consortium 3 definitions.
RESULTS: A total of 597 patients (aged 79.6±7.1 years at the time of TAVI; 47.2% male, mean Society of Thoracic Surgeons score 5.0%) were included. At a median of 6.1 years of follow-up (interquartile range 5.2-7.3 years), the crude incidence of moderate/severe SVD was 9.5% (n=57; moderate: 6.2%, n=37; severe: 3.4%, n=20). Predictors of SVD identified by Cox regression analysis were use of an intra-annular THV (hazard ratio [HR] 38.44, 95% confidence interval [CI]: 10.8-136.3; p<0.001), a small THV size (HR 4.82, 95% CI: 2.42-9.60; p<0.001) and moderate/severe postprocedural paravalvular leak (HR 3.64, 95% CI: 1.59-8.32; p=0.002).
CONCLUSIONS: The incidence of moderate/severe SVD during long-term follow-up after TAVI is low, with severe SVD being even rarer than moderate SVD. SVD occurs more frequently in patients treated with older-generation intra-annular valves and in those with small-sized THVs.","['Cristina Giannini', 'Davide Capodanno', 'Gabor G Toth', 'Stephan Windecker', 'Stefanie Schüpke', 'Daniel J Blackman', 'Stéphane Noble', 'Hélène Eltchaninoff', 'Claudia Fiorina', 'Alaide Chieffo', 'Antonio L Bartorelli', 'Albrecht Schmidt', 'Ole De Backer', 'Martine Gilard', 'Elizabeth Curtis', ""Guillaume L'Official"", 'Erwan Donal', 'Cécile Laroche', 'Bernard Prendergast', 'Anna Sonia Petronio', 'On Behalf The European Valve Durability Tavi Registry Investigators']",EuroIntervention : journal of EuroPCR in collaboration with the Working Group on Interventional Cardiology of the European Society of Cardiology,2025-05-16,10.4244/EIJ-D-24-00662,https://doi.org/10.4244/EIJ-D-24-00662,PMC12063547,Paid,Long term structural valve deterioration after TAVI insights from the EORP ESC Valve Durability TAVI Registry GIANNINI 2025,Not downloaded,"['EORP ESC Valve', 'ESC Valve Durability', 'EORP ESC', 'Durability TAVI Registry', 'Valve Durability TAVI', 'Valve Durability', 'Durability TAVI', 'European Valve Durability', 'ESC Valve', 'structural valve deterioration']",2025-05-27,Pending,[]
40372482,Mid- to long-term outcomes of covered balloon-expandable stent implantation for the management of vascular injuries in patients undergoing transfemoral transcatheter aortic valve implantation: the BE-SAFE Registry : for the RECOVER (REsults after percutaneous interventions with COVERed stents) Investigators.,"BACKGROUND AND AIMS: Vascular complications occur in a non-negligible proportion of transfemoral transcatheter aortic valve implantation (Tf-TAVI) procedures. There is only limited evidence regarding the efficacy and safety of covered balloon-expandable (CBE) stents in the management of Tf-TAVI related vascular complications. We aimed to investigate the efficacy and safety of CBE stent implantation to treat access-related vascular complications in patients undergoing Tf-TAVI.
METHODS: The present retrospective analysis included patients undergoing CBE stent implantation following Tf-TAVI from April 2012 to January 2023 at our centre. The primary endpoint was technical success defined as successful device delivery and implantation at the intended location with angiographic confirmation of vessel patency and absence of residual bleeding. Clinical outcomes and color Doppler ultrasonography findings were evaluated at discharge, 30 days and longest available follow-up.
RESULTS: Among 3331 Tf-TAVI procedures, 93 patients (2.8%) required covered stent implantation for the treatment of access related vascular complications. Technical success was achieved in 92 patients (98.9%). BeGraft and Atrium Advanta V12 CBE stents were implanted in 76 (81.7%) and 17 (18.3%) patients, respectively. Median clinical follow-up was 455 [304; 798] days, with both in-hospital and 30-days mortality equaling 4.3% and 1-year mortality 15.1%. Pre-discharge Doppler ultrasonography was performed in 98.9% patients, with normal findings in 79.8% and minor findings (such as pseudoaneurysm, non-flow-limiting dissection, arterio-venous fistula) in the remaining patients. Clinical follow-up was available in 96.2% patients; no cases of new-onset claudication, need for repeat surgical or transcatheter vascular interventions were recorded. Follow-up Doppler ultrasonography (54.4% patients) showed persistent patency and no signs of stent failure in all patients.
CONCLUSIONS: CBE stent implantation for the treatment of access site related vascular complications after Tf-TAVI is associated with excellent technical success rates, optimal short- to mid-term patency rates as well as satisfactory long-term clinical outcomes.","['Hector A Alvarez-Covarrubias', 'Martin Jurisic', 'Finn Syryca', 'Charlotte Duesmann', 'Costanza Pellegrini', 'Tobias Rheude', 'N Patrick Mayr', 'Niklas Altaner', 'Moritz Kühlein', 'Tobias Lenz', 'Edna Blum', 'Yousuke Taniguchi', 'Gjin Ndrepepa', 'Christian Thilo', 'Heribert Schunkert', 'Adnan Kastrati', 'Sebastian Kufner', 'Salvatore Cassese', 'Michael Joner', 'Erion Xhepa']",Clinical research in cardiology : official journal of the German Cardiac Society,2025-05-15,10.1007/s00392-025-02651-2,https://doi.org/10.1007/s00392-025-02651-2,PMC7578005,Paid,Mid to long term outcomes of covered balloon expandable stent implantation for the management of vascular injuries in patients undergoing transfemoral transcatheter aortic valve implantation the BE SAFE Registry for the RECOVER REsults after percutaneous interventions with COVERed stents Investigators ALVAREZ-COVARRUBIAS 2025,Not downloaded,"['CBE stent implantation', 'transcatheter aortic valve', 'BE-SAFE Registry', 'transfemoral transcatheter aortic', 'aortic valve implantation', 'Vascular complications', 'CBE stent', 'stent implantation', 'related vascular complications', 'patients']",2025-05-27,Pending,"['Covered balloon-expandable stent', 'Transcatheter aortic valve implantation', 'Transfemoral access', 'Vascular complication']"
40371620,Rationale and Design of the REPEAT Trial: A Multicenter Randomized Trial Comparing Redo Surgical Aortic Valve Replacement to Valve-in-Valve Transcatheter Aortic Valve Replacement.,"BACKGROUND: Redo surgical aortic valve replacement (rSAVR) has for long been the therapeutic reference standard for degenerated surgical aortic bioprostheses. Valve-in-valve transcatheter aortic valve replacement (ViV-TAVR) has emerged as an alternative for patients at high surgical risk due to its lower invasiveness. The long-term clinical efficacy of ViV-TAVR in patients at low to intermediate surgical risk remains unknown.
METHODS AND RESULTS: To compare clinical outcomes of redo surgical aortic valve replacement versus ViV-TAVR in low- to intermediate-risk patients with degenerated surgical aortic bioprostheses. REPEAT (Repeat Intervention for Deteriorated Surgical Bioprosthetic Aortic Valves) is an investigator-initiated, international, multicenter, randomized, parallel, open-label trial. A total of 890 patients aged <75 years with a failed surgical aortic bioprosthesis due to structural valve degeneration and low to intermediate surgical risk (ie, Society of Thoracic Surgeons predicted risk of death of <8%) will be randomly assigned in a 1:1 ratio to either redo surgical aortic valve replacement or ViV-TAVR. The primary end point of REPEAT is a composite of all-cause death, stroke (including both disabling and nondisabling), myocardial infarction, and rehospitalization for heart failure or aortic valve reintervention at 5 years, based on Valve Academic Research Consortium-3 definitions. Secondary end points include each of the individual components of the primary composite end point, Valve Academic Research Consortium-3-based conduction disturbances and arrhythmia, Valve Academic Research Consortium-3-based wound and bleeding complications, functional status (ie, 6-minute walk test, Kansas City Cardiomyopathy questionnaire), and treatment costs.
CONCLUSIONS: The REPEAT trial has been designed to test the hypothesis that redo surgical aortic valve replacement is superior to ViV-TAVR regarding clinical outcomes at 5 years in patients with degenerated surgical aortic bioprostheses and low to intermediate surgical risk.","['Matthias Raschpichler', 'Suzanne de Waha', 'Stefan Blankenberg', 'Marcio A Diniz', 'Emilia Bagiella', 'Annetine C Gelijns', 'Vinicius F Calsavara', 'Aakriti Gupta', 'Niklas Schofer', 'Tsuyoshi Kaneko', 'Mohamed Abdel-Wahab', 'Holger Thiele', 'Raj Makkar', 'Michael A Borger']",Journal of the American Heart Association,2025-05-20,10.1161/JAHA.125.040954,https://doi.org/10.1161/JAHA.125.040954,,Paid,Rationale and Design of the REPEAT Trial A Multicenter Randomized Trial Comparing Redo Surgical Aortic Valve Replacement to Valve in Valve Transcatheter Aortic Valve Replacement RASCHPICHLER 2025,Not available,"['Aortic Valve Replacement', 'Surgical Aortic Valve', 'Redo Surgical Aortic', 'Transcatheter Aortic Valve', 'Aortic Valve', 'Surgical Aortic', 'Comparing Redo Surgical', 'Valve Academic Research', 'Valve Replacement', 'Trial Comparing Redo']",2025-05-27,Pending,"['aortic stenosis', 'failed surgical aortic bioprosthesis', 'redo surgical aortic valve replacement', 'structural valve deterioration', 'valve‐in‐valve transcatheter aortic valve replacement']"
40371611,Comparing Major Gastrointestinal Bleeding in Patients Receiving Edoxaban Versus Warfarin After Transcatheter Aortic Valve Replacement: Results From the Randomized ENVISAGE-TAVI AF Trial.,"BACKGROUND: Non-vitamin K oral anticoagulants are recommended over vitamin K antagonists in patients with nonvalvular atrial fibrillation (AF). However, the risk of gastrointestinal bleeding may be higher with non-vitamin K oral anticoagulants versus vitamin K antagonists. Patients after successful transcatheter aortic valve replacement (TAVR) who are elderly and frail have worse outcomes with major gastrointestinal bleeding (MGIB), including death. This study evaluated incidence, predictors, and impact of MGIB among patients with AF after successful TAVR.
METHODS: This on-treatment analysis of ENVISAGE-TAVI AF (Edoxaban Compared to Standard Care After Heart Valve Replacement Using a Catheter in Patients With Atrial Fibrillation) included patients who received ≥1 dose of the study drug. Demographic, clinical, and procedural characteristics were compared between patients with versus without an MGIB event. Cox multivariable regression analysis identified predictors of MGIB.
RESULTS: Of 1377 patients in this analysis, 83 (6.0%) experienced MGIB, with 56 (67.5%) of these patients receiving edoxaban. Patients with versus without MGIB were more likely to have undergone percutaneous coronary intervention ≤30 days before TAVR (9.6% versus 4.2%; P=0.03), a higher ejection fraction (mean±SD, 58.0±10.4 versus 55.3±11.5; P=0.04), and carotid artery disease (13.3% versus 6.6%; P=0.04). Edoxaban without dose adjustment versus vitamin K antagonist use (P=0.003), smoking (P=0.01), low hemoglobin levels (P<0.0001), and percutaneous coronary intervention ≤30 days before TAVR (P=0.01) emerged as predictors of MGIB.
CONCLUSIONS: In this ENVISAGE-TAVI AF subanalysis, MGIB occurred in 6.0% of patients with prevalent or incident AF undergoing TAVR, and those receiving edoxaban versus vitamin K antagonists had a higher risk of MGIB. A priori identification of risk factors for MGIB may help optimize outcomes for patients with AF undergoing TAVR.
REGISTRATION: URL: https://www.clinicaltrials.gov; unique identifier: NCT02943785.","['George D Dangas', 'Martin Unverdorben', 'Johny Nicolas', 'Christian Hengstenberg', 'Cathy Chen', 'Helge Möllmann', 'James Jin', 'Fayaz Shawl', 'Masanori Yamamoto', 'Shigeru Saito', 'Rainer Hambrecht', 'Anil Duggal', 'Nicolas M Van Mieghem']",Journal of the American Heart Association,2025-05-20,10.1161/JAHA.123.033321,https://doi.org/10.1161/JAHA.123.033321,,Paid,Comparing Major Gastrointestinal Bleeding in Patients Receiving Edoxaban Versus Warfarin After Transcatheter Aortic Valve Replacement Results From the Randomized ENVISAGE TAVI AF Trial DANGAS 2025,Not available,"['Transcatheter Aortic Valve', 'Aortic Valve Replacement', 'Edoxaban Versus Warfarin', 'Major Gastrointestinal Bleeding', 'Comparing Major Gastrointestinal', 'MGIB', 'Valve Replacement', 'Patients', 'Versus Warfarin', 'Gastrointestinal Bleeding']",2025-05-27,Pending,"['atrial fibrillation', 'edoxaban', 'major gastrointestinal bleeding', 'transcatheter aortic valve implantation']"
40371608,Sex-Associated Disparities in Surgical and Percutaneous Management of Aortic Stenosis With Severe Features: Retrospective Analysis From the National Readmission Database.,"BACKGROUND: Referral for valve intervention for severe aortic stenosis (AS) may exhibit sex-associated disparities independent of the growth of transcatheter interventions. This study aimed to determine whether there were sex-associated differences in the use of aortic valve replacement (AVR), either surgical or transcatheter, in patients with aortic stenosis and severe features from a national cohort of patients.
METHODS: Using the National Readmission Database, all patients with an index diagnosis of AS between January 2015 and December 2019 were included and stratified by their 90-day readmission status and sex. AS with severe features was defined as the combination of primary- or secondary-coded diagnosis of AS in combination with heart failure, syncope, angina pectoris, cardiac arrest, or cardiogenic shock. A 1:1 nested case-control matching was performed to account for competing risk. The main investigated outcome was the sex-associated rate of AVR in the 90 days after index hospitalization.
RESULTS: A total of 31 712 matched weighted discharges were included in the analysis, 16 597 men (52.3%) and 15 116 women (47.7%). At 90 days, the rate of AVR was significantly lower in women (45.7% versus 53.6%, P<0.001) with significant difference for both surgical (P<0.001) and transcatheter (P=0.010) interventions. After multivariable adjustment, these differences persisted with women significantly less likely to receive AVR (adjusted odds ratio [aOR], 0.67 [95% CI, 0.63-0.71], P<0.001), either surgical AVR (aOR, 0.48 [95% CI, 0.43-0.54], P<0.001) or transcatheter aortic valve implantation (aOR, 0.79 [95% CI, 0.75-0.84], P<0.001).
CONCLUSIONS: The use of surgical AVR and transcatheter aortic valve implantation was significantly lower in female patients with AS and severe features independent from patient- and hospital-level characteristics.","['Gianluca Castaldi', 'Andrija Matetić', 'Rodrigo Bagur', 'J D Abbott', 'Mirvat Alasnag', 'Alaide Chieffo', 'Harindra C Wijeysundera', 'Mamas A Mamas']",Journal of the American Heart Association,2025-05-20,10.1161/JAHA.124.038463,https://doi.org/10.1161/JAHA.124.038463,,Paid,Sex Associated Disparities in Surgical and Percutaneous Management of Aortic Stenosis With Severe Features Retrospective Analysis From the National Readmission Database CASTALDI 2025,Not available,"['National Readmission Database', 'Percutaneous Management', 'severe aortic stenosis', 'Readmission Database', 'Aortic Stenosis', 'Severe Features', 'Retrospective Analysis', 'National Readmission', 'Sex-Associated Disparities', 'Aortic']",2025-05-27,Pending,"['aortic valve replacement', 'disparities', 'sex', 'transcatheter aortic valve intervention']"
40371597,Anatomical and Functional Predictors of Permanent Pacemaker Implantation After Transcatheter Aortic Valve Implantation.,"BACKGROUND: High-degree atrioventricular block with the need for permanent pacemaker (PPM) implantation represents a frequent complication after transcatheter aortic valve implantation (TAVI). Extension of indication for TAVI toward subjects with lower surgical risk requires reduction of the likelihood for the need for PPM implantation. The aim of the current analysis was to identify predictors of the need for PPM implantation after TAVI.
METHODS AND RESULTS: In a cohort of 1500 consecutive patients without a PPM undergoing transfemoral TAVI, clinical and procedural characteristics as well as parameters derived from cardiac computed tomography, such as membranous septal length and calcium volumes of the aortic valve cusps and the left ventricular outflow tract were assessed. Median calcium volume of the aortic valve was 552 mm3 (interquartile range [IQR]: 340-811 mm3) in the group of subjects requiring a PPM, which was higher than in the group of subjects not requiring PPM implantation (455 mm3 [IQR: 245-723 mm3], Padj=0.001). The same was true for calcification of the noncoronary cusp (Padj=0.027), left coronary cusp (Padj=0.033), and right coronary cusp (Padj=0.006). In multivariable analysis, calcium volume of the noncoronary cusp (P=0.039; odds ratio [OR], 1.089 per 100 mm3), preexisting complete right bundle-branch block (P<0.001; OR, 9.402), and implantation of a self-expandable prosthesis (P<0.001; OR, 1.856) were significantly associated with PPM implantation after TAVI.
CONCLUSIONS: The current analysis offers a detailed examination of predictors for the need for PPM implantation after TAVI. Our results may contribute to improved risk stratification on the need for PPM implantation after TAVI.","['Susanne Jung', 'Markus Kondruweit', 'Mohamed Marwan', 'Stephan Achenbach']",Journal of the American Heart Association,2025-05-20,10.1161/JAHA.124.039020,https://doi.org/10.1161/JAHA.124.039020,,Paid,Anatomical and Functional Predictors of Permanent Pacemaker Implantation After Transcatheter Aortic Valve Implantation JUNG 2025,Not available,"['PPM implantation', 'Transcatheter Aortic Valve', 'Permanent Pacemaker Implantation', 'Aortic Valve Implantation', 'Anatomical and Functional', 'Permanent Pacemaker', 'PPM', 'Aortic Valve', 'Implantation', 'Transcatheter Aortic']",2025-05-27,Pending,"['atrioventricular block', 'cardiac computed tomography', 'permanent pacemaker', 'transcatheter aortic valve implantation']"
