pubmed_id,title,abstract,authors,journal,publication_date,doi,fulltext_link,pmcid,access,updated_title,pdf_file,suggested_tags,webscraped_date,status,keywords
40402169,Long-term results of transcatheter aortic valve replacement in degenerated surgical aortic valves-a propensity score matched analysis.,"BACKGROUND: The aim of this study was to analyse long-term valve function and all-cause mortality of patients undergoing transcatheter aortic valve replacement (TAVR) due to degenerated surgical aortic valve (SAV) bioprostheses.
METHODS: In this single-center study, all consecutive patients undergoing TAVR between December 2012 and December 2020 were included. Long-term echocardiographic results, functional status and 5-year all-cause mortality were analysed in patients with TAV-in-SAV and native valve TAVR in a propensity score matched analysis.
RESULTS: Out of 3423 patients who were eligible for the study, 136 experienced bioprosthetic valve dysfunction, whereas 3287 patients underwent native valve TAVR. After 2:1 propensity score matching, baseline characteristics without relation to prior SAVR were comparable between both groups. Regarding 5-year all-cause mortality, no difference was observed between patients with prior SAVR and native valve TAVR, in either unadjusted analysis, or after propensity score matching (corresponding hazard ratio: 0.95, 95% CI: 0.70-1.30, p = 0.75). In addition, while pressure gradients were higher in patients with TAV-in-SAV in long-term echocardiographic follow-up, moderate or severe hemodynamic valve deterioration did not occur more often in this group.
CONCLUSIONS: In this propensity score matched analysis, long-term all-cause mortality and echocardiographic valve function of patients with TAVR in prior bioprosthesis were comparable to patients with native valve TAVR.","['Kornelia Löw', 'Julius Steffen', 'Nike Knufinke', 'Carolin Fröhlich', 'Julius Fischer', 'Magda Haum', 'Hans Theiss', 'Sven Peterss', 'Konstantin Stark', 'Jörg Hausleiter', 'Steffen Massberg', 'Simon Deseive']",Clinical research in cardiology : official journal of the German Cardiac Society,2025-05-22,10.1007/s00392-025-02670-z,https://doi.org/10.1007/s00392-025-02670-z,PMC10984572,Free,Long term results of transcatheter aortic valve replacement in degenerated surgical aortic valves a propensity score matched analysis LÖW 2025,pdfs\Long term results of transcatheter aortic valve replacement in degenerated surgical aortic valves a propensity score matched analysis LW 202.pdf,"['aortic valve', 'transcatheter aortic valve', 'surgical aortic valve', 'valve', 'aortic valve implantation', 'severe aortic valve', 'aortic valve replacement', 'aortic', 'native valve TAVR', 'bioprosthetic aortic valves']",2025-05-27,Pending,"['Aortic stenosis', 'Bioprosthetic valve', 'Transcatheter aortic valve replacement']"
40401761,Economic option value associated with surgical aortic valve replacement using a novel bioprosthetic and a future transcatheter aortic valve-in-valve procedure.,"INTRODUCTION: Optimal lifetime management of surgical aortic valve replacement (SAVR) patients should account for the expected clinical and economic value of the index procedure as well as the future trajectory of health outcomes. This study estimates the discounted per surgery ""total value"" (from the time of initial SAVR operation through 25 years post-surgery) and the option value (after reoperation) that mechanical SAVR patients forego by choosing a device that does not allow for valve-in-valve transcatheter aortic valve reoperation (ViV/TAVR).
METHODS: The model adopts a US payer perspective and tracks major health events, anti-coagulant monitoring, maintenance, and expenditures associated with these events following initial SAVR procedures, inclusive of costs before and after a potential reoperation. We compare the expected utilization and expenditures for tissue valve patients and mechanical valve patients over a 25-year period. The model also compares the experience of mechanical SAVR patients after reoperation to a counterfactual group receiving ViV/TAVR to estimate option value. Monte Carlo simulation, sensitivity analyses, scenario analyses, and break-even analyses were conducted to account for variation in inputs.
RESULTS: Novel SAVR treatment for aortic stenosis followed by ViV TAVR for reoperation reduces 25-year payer expenditures relative to mechanical valves by either $34,621 (95% CI: 17,426-52,218), $31,363 (95% CI: $19,871 -$43,399) or $23,303 (95% CI: $16,906-$30,075) depending on the age of initial SAVR operation. During this period, the ""option value"" share of overall savings ranges from 8-17% and generally is lower for older patients. Reoperation and anti-coagulant monitoring are important drivers of overall savings and option value.
CONCLUSION: The deterministic and simulation models both demonstrate that novel SAVR tissue valves, followed by a ViV/TAVR, result in lower 25-year expected costs than a treatment strategy using mechanical SAVR valves, and option value is a component of these savings.","['Eric L Keuffel', 'Matt Reifenberger', 'Andrew Pellegrini', 'Pradeep Yadav', 'Vinod H Thourani']",Journal of medical economics,2025-12-27,10.1080/13696998.2025.2503664,https://doi.org/10.1080/13696998.2025.2503664,,Paid,Economic option value associated with surgical aortic valve replacement using a novel bioprosthetic and a future transcatheter aortic valve in valve procedure KEUFFEL 2025,Not available,"['surgical aortic valve', 'aortic valve replacement', 'SAVR', 'mechanical SAVR patients', 'initial SAVR', 'mechanical SAVR', 'initial SAVR operation', 'aortic valve', 'initial SAVR procedures', 'mechanical SAVR valves']",2025-05-27,Pending,"['I10', 'I11', 'I18', 'RESILIA', 'Surgical aortic valve replacement', 'bioprosthetic aortic valve', 'health economics', 'option value', 'outcomes research']"
40398959,Survival and cause of death after isolated primary aortic valve replacement at Oslo University Hospital (2012-2021): a retrospective registry-based study.,"BACKGROUND: The treatment of aortic valve disease has changed following the introduction of transcatheter aortic valve replacement (TAVR). Hence, the selection of patients for surgical aortic valve replacement (AVR) is changing. Thus, we aimed to study survival and causes of death following surgical AVR at a large Scandinavian Centre in the period 2012-21.
METHODS: Information about the surgical procedure, survival and cause of death was obtained from the National Norwegian Health Registries. The latest clinical information about the deceased patients was made available from the local hospitals and examined to evaluate the causes of death from The Norwegian Cause of Death Registry.
RESULTS: From 2012 to 2021, the number of surgical implantations of aortic valve bioprostheses (AVR(b)) and patient age at the time of surgery decreased. Outcomes were excellent, with 30-day survival of 98.6% following AVR(b) and 99.8% following AVR(m). 1-year survival after AVR(b) improved from 96.4% in the first half to 98.4% in the second half of the study period, probably due to a reduction of operative risk during the study period. Non-cardiovascular mortality was the most frequent cause of death, followed by cancer, cardiovascular and valve-related death. Deaths due to cerebral bleeding or stroke were the least frequent with 10-year estimators of 1.3% and 1.6% following AVR(m) and AVR(b), respectively. The inter-rater reliability between The Norwegian Cause of Death Registry and the journal information provided was moderate, with an unweighted Cohen's kappa of 0.56 (0.47-0.64).
CONCLUSIONS: Valve-related death and death from cerebral bleeding or stroke was rare after surgical AVR. Survival was high and improved during the study period. Surgical AVR may be performed safely in low-risk patients.","['Johannes Lagethon Bjørnstad', 'Sandra Stedje Waagan', 'Tiril Karina Tegnander', 'Anne Madsi Ottestad']",Open heart,2025-05-21,10.1136/openhrt-2025-003312,https://doi.org/10.1136/openhrt-2025-003312,PMC12096966,Free,Survival and cause of death after isolated primary aortic valve replacement at Oslo University Hospital 2012 2021 a retrospective registry based study BJØRNSTAD 2025,pdfs\Survival and cause of death after isolated primary aortic valve replacement at Oslo University Hospital 2012 2021 a retrospective registry b.pdf,"['Oslo University Hospital', 'AVR', 'surgical AVR', 'aortic valve replacement', 'aortic valve', 'death', 'Death Registry', 'surgical aortic valve', 'Oslo University', 'University Hospital']",2025-05-27,Pending,"['Heart Valve Diseases', 'Heart Valve Prosthesis', 'Heart Valve Prosthesis Implantation', 'Outcome Assessment, Health Care']"
40397427,Hemodynamic Impact of Cipepofol vs Propofol During Anesthesia Induction in Patients With Severe Aortic Stenosis: A Randomized Clinical Trial.,"IMPORTANCE: Postinduction hemodynamic instability is a frequent complication among patients with severe aortic stenosis (AS). Using cipepofol as the anesthesia agent may reduce the incidence and severity of hemodynamic instability.
OBJECTIVE: To assess whether cipepofol outperforms propofol in maintaining postinduction hemodynamic stability in patients with AS.
DESIGN, SETTING, AND PARTICIPANTS: This single-center, randomized clinical trial was conducted from June 29, 2023, to July 8, 2024, at the Second Affiliated Hospital of Zhejiang University School of Medicine in China. Patients with AS scheduled for transcatheter aortic valve replacement (TAVR) were eligible for inclusion.
INTERVENTIONS: Participants were randomized 1:1 to receive either cipepofol or propofol as anesthesia induction agents at equipotent doses.
MAIN OUTCOMES AND MEASURES: The primary outcome was the area under the curve (AUC) of the mean arterial pressure (MAP) difference from baseline during the initial 15 minutes postinduction.
RESULTS: A total of 124 patients with AS scheduled for TAVR were randomized into either the cipepofol group (n = 62) or the propofol group (n = 62). Of 124 patients randomized, 1 patient from each group was excluded due to ineligibility for the TAVR procedure, and data were analyzed for 122 patients (61 patients per group) based on the intention-to-treat principle. Among 122 total patients, mean (SD) age was 72.2 (5.0) years, and 53 patients (43.4%) were female. The cipepofol group exhibited a significantly smaller median (IQR) AUC (-8505.0 mm Hg · s [-12 402.8 to -5130.0]) compared with the propofol group (-13 189.0 mm Hg · s [-17 006.7 to -7593.3]; P < .001). Moreover, compared with the propofol group, the cipepofol group demonstrated a significantly lower incidence of postinduction hypotension (70.5% vs 88.5%; P = .01) and required a smaller median (IQR) dose of norepinephrine during the first 15 minutes postinduction (6.0 μg [0.0-10.0] vs 10.0 μg [5.0-20.0]; P = .006). Additionally, the 2 groups' bispectral indices were comparable.
CONCLUSIONS AND RELEVANCE: In this randomized clinical trial, cipepofol provided superior hemodynamic stability as an induction agent compared to propofol at equipotent doses and similar anesthesia depths for patients with AS. Therefore, cipepofol could serve as an alternative induction agent to propofol for patients at high cardiovascular risk.
TRIAL REGISTRATION: ClinicalTrials.gov Identifier: NCT05881291.","['Tingting Ni', 'Xiaoxia Zhou', 'Shuguang Wu', 'Tao Lv', 'Yujiao Hu', 'Qi Gao', 'Ge Luo', 'Chen Xie', 'Jingcheng Zou', 'Yuexiu Chen', 'Linqian Zhao', 'Jie Xiao', 'Xincheng Tao', 'Yu Yi', 'Zhili Xu', 'Tingting Wang', 'Junyu Zhou', 'Yuanyuan Yao', 'Min Yan']",JAMA surgery,2025-05-21,10.1001/jamasurg.2025.1299,https://doi.org/10.1001/jamasurg.2025.1299,PMC12096327,Paid,Hemodynamic Impact of Cipepofol vs Propofol During Anesthesia Induction in Patients With Severe Aortic Stenosis A Randomized Clinical Trial NI 2025,Not downloaded,"['Severe Aortic Stenosis', 'Aortic Stenosis', 'Severe Aortic', 'Hemodynamic Impact', 'Randomized Clinical Trial', 'Patients', 'Cipepofol', 'Propofol', 'Randomized Clinical', 'Clinical Trial']",2025-05-27,Pending,[]
40396898,Continued Versus Interrupted Oral Anticoagulation During Transcatheter Aortic Valve Replacement in Patients With Atrial Fibrillation: A Meta-Analysis.,"INTRODUCTION: A substantial number of patients undergoing transcatheter aortic valve replacement (TAVR) require long-term oral anticoagulants (OAC) owing to comorbidities. This study examined whether continuing oral anticoagulation periprocedurally during TAVR is as safe and effective as interrupting it.
METHODS: A systematic search of the major databases was performed to identify relevant studies. Effect estimates were calculated using risk ratios (RR) and 95% CIs by pooling the data using the inverse-variance random effects model. Statistical significance was set at P < 0.05.
RESULTS: Four studies were included, with 2962 patients undergoing TAVR with continued OAC (n = 1318) and interrupted OAC (n = 1644). The pooled analysis demonstrated that TAVR with continued OAC had comparable risks for all-cause mortality (RR: 0.91; 95% CI, 0.62-1.34; P = 0.64), cardiovascular mortality (RR: 0.89; 95% CI, 0.43-1.84; P = 0.76), stroke (RR: 0.67; 95% CI, 0.42-1.08; P = 0.09), closure device failure (RR: 0.86; 95% CI, 0.47-1.59; P = 0.64), major/life-threatening bleeding (RR: 0.93; 95% CI, 0.74-1.15; P = 0.49), and major vascular complications (RR: 0.97; 95% CI, 0.79-1.20; P = 0.80) compared with TAVR with interrupted OAC.
CONCLUSIONS: In patients undergoing TAVR, continued OAC showed comparable safety and efficacy with interrupted OAC. These findings demonstrate that continuing OAC in the periprocedural period may be a viable option in patients with atrial fibrillation because of comorbidities requiring anticoagulants.","['Hritvik Jain', 'Nandan Patel', 'Muhammad Daoud Tariq', 'Ali Saad Al-Shammari', 'Rozi Khan', 'Jyoti Jain', 'Rahul Patel', 'Faizan Ahmed', 'Raheel Ahmed', 'Thomas Alexander']",American journal of therapeutics,2025-05-21,10.1097/MJT.0000000000001979,https://doi.org/10.1097/MJT.0000000000001979,,Paid,Continued Versus Interrupted Oral Anticoagulation During Transcatheter Aortic Valve Replacement in Patients With Atrial Fibrillation A Meta Analysis JAIN 2025,Not available,"['Transcatheter Aortic Valve', 'Aortic Valve Replacement', 'Versus Interrupted Oral', 'Aortic Valve', 'Transcatheter Aortic', 'Valve Replacement', 'undergoing transcatheter aortic', 'Continued Versus Interrupted', 'Versus Interrupted', 'Oral Anticoagulation']",2025-05-27,Pending,"['TAVR', 'anticoagulation', 'aortic stenosis', 'transcatheter aortic valve replacement']"
40396229,Feasibility of Computed Tomography as a Gatekeeper for Invasive Angiography Before TAVR: A Pragmatic Real-World Experience.,"BACKGROUND: Although pretranscatheter aortic valve replacement-computed tomography angiography (TAVR-CTA) has shown a good correlation with invasive coronary angiography (ICA) for ruling out obstructive coronary artery disease (CAD), its clinical effectiveness and safety as a gatekeeper for ICA pre-transcatheter aortic valve replacement (pre-TAVR) remain unclear. This study aims to determine whether routine TAVR-CTA, without premedication, could safely defer and guide the need for ICA pre-TAVR.
METHODS: Patients who underwent TAVR evaluation with either TAVR-CTA or ICA to determine CAD between 2017 and 2022 were included. Patients with prior coronary artery bypass grafts were excluded, and the remaining patients were divided into CAD screening with TAVR-CTA or ICA groups. The primary outcome was symptom-driven revascularization at 1 year post-TAVR.
RESULTS: Among 1165 patients (median age, 81 years; 46% women), 464 were in TAVR-CTA group and 701 were in the ICA group. Prevalence of CAD was similar (37% versus 41%; P=0.2). A total of 53% of patients were exempted from ICA after TAVR-CTA, given the absence of proximal obstructive CAD, whereas 17% had inconclusive TAVR-CTA interpretation, 15% desired for ICA despite CAD exclusion by TAVR-CTA, and 14% had obstructive CAD requiring further ICA. Elevated coronary artery calcium score and the presence of stents were associated with need for ICA after TAVR-CTA. TAVR-CTA revealed a per-patient sensitivity of 89%, specificity of 75%, positive predictive value of 69%, and negative predictive value of 91% for identifying obstructive CAD. Importantly, symptom-driven revascularization, acute coronary syndrome, and unplanned ICA at 1 year after TAVR were all low and not different between TAVR-CTA versus ICA (0.8% versus 1.8%, P=0.158; 1.6% versus 1.7%, P=0.846; 2.7% versus 2.8%, P=0.767; respectively).
CONCLUSIONS: In comparison with routine ICA pre-TAVR, integration of TAVR-CTA in our program resulted in up to 53% of patients exempted from ICA, while maintaining patient safety. This approach could have important clinical implications to improve patient access, experience, value, and throughput.","['Asa Phichaphop', 'Paul Sorajja', 'Maurice Enriquez-Sarano', 'Miho Fukui', 'Atsushi Okada', 'Davide Margonato', 'Mohammed Abed', 'Takahiro Nishihara', 'Hideki Koike', 'Evan Walser-Kuntz', 'John R Lesser', 'Victor Y Cheng', 'Vinayak N Bapat', 'Nadira Hamid', 'João L Cavalcante']",Circulation. Cardiovascular interventions,2025-05-21,10.1161/CIRCINTERVENTIONS.125.015181,https://doi.org/10.1161/CIRCINTERVENTIONS.125.015181,,Paid,Feasibility of Computed Tomography as a Gatekeeper for Invasive Angiography Before TAVR A Pragmatic Real World Experience PHICHAPHOP 2025,Not available,"['Pragmatic Real-World Experience', 'Computed Tomography', 'ICA', 'Feasibility of Computed', 'Pragmatic Real-World', 'invasive coronary angiography', 'replacement-computed tomography angiography', 'CAD', 'Invasive Angiography', 'tomography angiography']",2025-05-27,Pending,"['aortic valve stenosis', 'computed tomography angiography', 'coronary artery disease', 'patient safety', 'transcatheter aortic valve replacement']"
40396187,A Case of Treatment With a Combination of Covered Stents and Artificial Blood Vessel for Iliac Artery Rupture During Transcatheter Aortic Valve Replacement.,"Vascular complications (VCs) associated with Transcatheter Aortic Valve Replacement (TAVR), particularly iliac artery rupture, pose significant challenges. We report a case of complete iliac artery disruption during TAVR. A combination of a covered stent and artificial blood vessel repair was employed to achieve revascularization of the iliac artery. In this case, the patient was placed on bed rest for 10 days to avoid stent dislodgement due to early movement and was discharged from the hospital 13 days later. After that, the patient stayed away from significant lower limb activity for 3 months after surgery and underwent enhanced follow-up. Regular follow-up indicated that the patient recovered well, with no significant discomfort in the right lower limb and consistent pulse in the dorsal foot artery on both sides. The treatment of such complications typically involves surgical intervention, while this method shows a new viable option for managing such VCs. By using this method, blood flow can be blocked more quickly than through surgery, which reduced the risk of massive bleeding, death, and limb loss and improved the prognosis.","['Wensheng Zhu', 'Hanqing Deng', 'Weiqing Hu', 'Shixun Wang']",Clinical case reports,2025-05-27,10.1002/ccr3.70523,https://doi.org/10.1002/ccr3.70523,PMC12090355,Free,A Case of Treatment With a Combination of Covered Stents and Artificial Blood Vessel for Iliac Artery Rupture During Transcatheter Aortic Valve Replacement ZHU 2025,pdfs\A Case of Treatment With a Combination of Covered Stents and Artificial Blood Vessel for Iliac Artery Rupture During Transcatheter Aortic Va.pdf,"['Aortic Valve Replacement', 'Transcatheter Aortic Valve', 'Aortic Valve', 'Valve Replacement', 'Clinical Case Reports', 'Iliac Artery Rupture', 'Iliac Artery', 'Transcatheter Aortic', 'Artificial Blood Vessel', 'Artery']",2025-05-27,Pending,"['aortic stenosis', 'artery reconstruction', 'iliac artery rupture', 'transcatheter aortic valve replacement', 'vascular complication']"
40394980,Valve-in-Valve TAVR for Degenerated Surgical Valves in Patients With Small Aortic Annuli: A Report From a Japanese Nationwide Registry.,"BACKGROUND: Valve-in-valve transcatheter aortic valve replacement (ViV-TAVR) provides an alternative treatment for high-risk patients with failed surgical bioprosthetic aortic valves. However, limited data exist on ViV-TAVR outcomes in patients with small aortic annuli, particularly among the relatively small-statured Japanese population.
METHODS: We analyzed data from the J-TVT (Japan Transcatheter Valve Therapy) registry, which included all TAVR institutions across Japan, with data collected from July 2018, when ViV-TAVR was approved, through December 2022. A small aortic annulus was defined as an aortic annulus area of ≤314 mm², measured using preoperative computed tomography for ViV-TAVR. Prosthesis-patient mismatch (PPM) was defined as an indexed effective orifice area <0.85 cm²/m², assessed using echocardiography within 30 days after ViV-TAVR. The composite endpoint was evaluated at 30 days and 1 year.
RESULTS: Among 47 800 individuals, 1029 underwent ViV-TAVR, resulting in a final sample of 405 patients. The mean indexed effective orifice area was 0.83 cm²/m² in the small annulus group (n=225) and 0.94 cm²/m² in the nonsmall group (n=180), with PPM rates of 59.2% and 44.4%, respectively. Small annuli were independently associated with PPM (hazard ratio, 1.9 [95% CI, 1.26-2.87]; P=0.002). No differences in 30-day and 1-year outcomes were observed between groups. Among the 225 patients with small annuli, the mean indexed effective orifice area was 0.76 cm2/m2 in the balloon-expandable valve group (n=61) and 0.86 cm2/m2 in the supraannular self-expanding valve group (n=164), with PPM rates of 67.2% and 56.1%, respectively. No differences in outcomes were noted based on the type of valve implanted.
CONCLUSIONS: ViV-TAVR for small aortic annuli in Japanese patients was associated with an increased risk of PPM; however, no differences in clinical outcomes were observed according to aortic annulus size or valve type. Due to the small size of our sample, further research is required to validate these findings.","['Yusuke Oba', 'Hiraku Kumamaru', 'Satoshi Hoshide', 'Shun Kohsaka', 'Kazuo Shimamura', 'Yohei Ohno', 'Masafumi Sato', 'Hisaya Kobayashi', 'Hiroshi Funayama', 'Kenji Harada', 'Koji Kawahito', 'Kazuomi Kario']",Circulation. Cardiovascular interventions,2025-05-20,10.1161/CIRCINTERVENTIONS.124.015087,https://doi.org/10.1161/CIRCINTERVENTIONS.124.015087,,Paid,Valve in Valve TAVR for Degenerated Surgical Valves in Patients With Small Aortic Annuli A Report From a Japanese Nationwide Registry OBA 2025,Not available,"['Japanese Nationwide Registry', 'Degenerated Surgical Valves', 'Degenerated Surgical', 'Japanese Nationwide', 'Nationwide Registry', 'Small Aortic Annuli', 'Small Aortic', 'Aortic', 'surgical bioprosthetic aortic', 'TAVR for Degenerated']",2025-05-27,Pending,"['aortic valve', 'echocardiography', 'heart valve prosthesis', 'tomography', 'transcatheter aortic valve replacement']"
40393868,Anxiety during transcatheter aortic valve replacement under local anesthesia - the ART-VR trial.,"BACKGROUND: The use of local anesthesia during transcatheter aortic valve replacement (TAVR) could result in patient discomfort. Application of immersive virtual reality (VR) during TAVR might distract the patient and enhance the overall experience.
OBJECTIVE: To evaluate the effect of an immersive VR environment on periprocedural anxiety and patient discomfort, compared to standard of care in patients undergoing transfemoral (TF) TAVR under local anesthesia.
METHODS: In this single-center, randomized controlled pilot study, patients were randomized to either VR immersion during TAVR or standard of care. The intervention was a VR headset to create 3D experiences during percutaneous transfemoral TAVR. The main outcome was patient-reported procedural anxiety assessed directly after the procedure on a visual analog scale (VAS). Secondary outcomes were procedural satisfaction, pain, and change in anxiety. Personality scores were obtained at baseline to explore associations between personality types and relevant outcomes.
RESULTS: A total of 75 patients (VR = 37, control = 38) were included between September 2021 and January 2023. The median age was 79 (25th-75th: 75-84) years and 32 patients (43 %) were female. Overall procedural anxiety VAS was 1.0 (0.0-3.0) and satisfaction was 9.0 (8.0-10.0). There was no difference in procedural anxiety between VR and control (VAS: 1.0 [25th-75th: 0.0-3.0] versus 1.0 [25th-75th: 0.0-3.0], p = 0.59). Procedural satisfaction, pain perception and change in anxiety were not affected by VR use.
CONCLUSION: Patients undergoing TF-TAVR under local anesthesia experienced mild procedural anxiety and high satisfaction levels. Procedural VR use did not affect procedural anxiety or pain perception.","['Sraman Chatterjee', 'Joris Ooms', 'Marjo de Ronde', 'Stefan van Gorsel', 'Antonio Maarten Mattace-Raso', 'Jeannette Goudzwaard', 'Francesco Mattace-Raso', 'Isabella Kardys', 'Rutger-Jan Nuis', 'Joost Daemen', 'Nicolas Van Mieghem']",Cardiovascular revascularization medicine : including molecular interventions,2025-05-15,10.1016/j.carrev.2025.05.015,https://doi.org/10.1016/j.carrev.2025.05.015,,Paid,Anxiety during transcatheter aortic valve replacement under local anesthesia the ART VR trial CHATTERJEE 2025,Not available,"['transcatheter aortic valve', 'aortic valve replacement', 'local anesthesia', 'transcatheter aortic', 'aortic valve', 'TAVR', 'valve replacement', 'Anxiety', 'ART-VR trial', 'procedural']",2025-05-27,Pending,"['Anesthesia', 'Anxiety', 'Pain', 'TAVR', 'VR']"
