pubmed_id,title,abstract,authors,journal,publication_date,doi,fulltext_link,pmcid,access,updated_title,pdf_file,suggested_tags,webscraped_date,status,keywords
40370817,Valve type and post-dilation impact on transprosthetic gradients in patients undergoing transcatheter aortic valve-in-valve procedure.,"AIMS: Valve-in-Valve transcatheter aortic valve replacement (ViV-TAVR) is an appealing treatment option for patients with degenerated aortic bioprosthetic valves. However, higher post-procedural transprosthetic gradients are more common after ViV-TAVR than after TAVR for native aortic valve stenosis. We sought to evaluate the impact of type of implanted valve and balloon post-dilation on echocardiographic results and mortality in ViV-TAVR patients.
METHODS AND RESULTS: One hundred and eleven consecutive patients were enrolled. A balloon-expandable valve, a self-expandable valve without balloon post-dilation, and a self-expandable valve with balloon post-dilation were performed in 35 (Group 1), 39 (Group 2), and 37 (Group 3) patients, respectively. All patients underwent comprehensive transthoracic echocardiography at baseline, discharge, and 6-12 months follow-up. Successful ViV-TAVR was performed in 110 patients (99%). Baseline transprosthetic gradients, left ventricular volumes, ejection fraction, and pulmonary artery systolic pressure were similar among groups. All groups experienced a significant reduction in post-procedural gradients at discharge and during the 6-12 months follow-up compared with baseline. At discharge, the lowest mean gradient was observed in Group 3 (12 ± 7 mmHg) compared with both Group 1 (20 ± 9 mmHg) and Group 2 (17 ± 8 mmHg, P = 0.001). This result was confirmed at 6-12 months follow-up (P = 0.012). Similar 5-year all-cause mortality was observed among groups (34%, 36%, 14%, respectively, P = 0.056).
CONCLUSION: In patients with failed surgical aortic prosthesis, ViV-TAVR is an effective treatment option associated with sustained improved haemodynamics regardless of transcatheter valve type and use of balloon post-dilation. However, self-expandable valves with balloon post-dilation showed lower transprosthetic gradients.","['Manuela Muratori', 'Laura Fusini', 'Gloria Tamborini', 'Paola Gripari', 'Sarah Ghulam Ali', 'Valentina Mantegazza', 'Anna Garlaschè', 'Francesco Doni', 'Andrea Baggiano', 'Francesco Cannata', 'Alberico Del Torto', 'Fabio Fazzari', 'Antonio Frappampina', 'Daniele Junod', 'Riccardo Maragna', 'Saima Mushtaq', 'Luigi Tassetti', 'Alessandra Volpe', 'Stefano Galli', 'Franco Fabbiocchi', 'Marco Gennari', 'Marco Agrifoglio', 'Antonio L Bartorelli', 'Federico De Marco', 'Mauro Pepi', 'Gianluca Pontone']",European heart journal. Imaging methods and practice,2025-01-27,10.1093/ehjimp/qyaf048,https://doi.org/10.1093/ehjimp/qyaf048,PMC12076146,Free,Valve type and post dilation impact on transprosthetic gradients in patients undergoing transcatheter aortic valve in valve procedure MURATORI 2025,pdfs\Valve type and post dilation impact on transprosthetic gradients in patients undergoing transcatheter aortic valve in valve procedure MURATO.pdf,"['Valve', 'balloon post-dilation', 'patients', 'Cardiologico Monzino IRCCS', 'Centro Cardiologico Monzino', 'aortic valve', 'Group', 'aortic valve replacement', 'aortic', 'Milan']",2025-05-27,Pending,"['aortic bioprosthesis', 'echocardiography', 'structural valve degeneration', 'transcatheter aortic valve replacement', 'valve in valve']"
40370009,Dual ProGlide Versus ProGlide and Angio-Seal for Femoral Access Hemostasias in Transcatheter Aortic Valve Replacement: A Meta-Analysis of Up-to-Date Evidence.,No Abstract Found,"['Farhan Naeem', 'Shehroze Tabassum', 'Muhammad Burhan', 'Usama Qamar', 'M Chadi Alraies', 'Dmitry Abramov']",Catheterization and cardiovascular interventions : official journal of the Society for Cardiac Angiography & Interventions,2025-05-15,10.1002/ccd.31577,https://doi.org/10.1002/ccd.31577,,Paid,Dual ProGlide Versus ProGlide and Angio Seal for Femoral Access Hemostasias in Transcatheter Aortic Valve Replacement A Meta Analysis of Up to Date Evidence NAEEM 2025,Not available,"['Aortic Valve Replacement', 'Femoral Access Hemostasias', 'Transcatheter Aortic Valve', 'Dual ProGlide Versus', 'Valve Replacement', 'ProGlide Versus ProGlide', 'Femoral Access', 'Access Hemostasias', 'Hemostasias in Transcatheter', 'Transcatheter Aortic']",2025-05-27,Pending,[]
40370003,Transcatheter Aortic Valve Replacement for Structural Valve Deterioration After Aortic Valve Neocuspidization.,"BACKGROUND: Evidence on structural valve deterioration (SVD) after aortic valve neocuspidization (AVNeo) remains limited. While transcatheter aortic valve replacement (TAVR) offers a less invasive option, its feasibility is unclear. This study aimed to characterize SVD patients post-AVNeo and to assess TAVR feasibility.
METHODS: This retrospective study included 11 patients who underwent TAVR for SVD after AVNeo in Sendai Kousei Hospital between June 2017 and August 2024. Four patients with aortic stenosis (AS) and seven with aortic regurgitation (AR) due to SVD were included.
RESULTS: AS-SVD group showed shorter time interval from AVNeo to TAVR (50.5 [28.3-98.3] vs. 107.0 [97.0-131.0] months, p = 0.04) and smaller aortic annulus area (316.5 [259.8-375.0] vs. 538.0 [440.0-582.0] mm2, p = 0.005) than AR-SVD group. In TAVR, technical success was achieved in 91% of cases. Although coronary obstruction is a concern due to the long leaflet, no case occurred. Misidentification of the basal ring plane caused by the slack cusp resulted in second valve implantation (one case) and new conduction disturbance (two cases) due to deep implantation, and aortic contained rupture (one case) for oversized valve selection.
CONCLUSIONS: Rapid AS-SVD progression and AR-SVD occurring later than previously reported were observed, highlighting the need for further studies on AVNeo durability. TAVR after AVNeo was feasible. Special precautions for coronary obstruction may be unnecessary. Careful hinge point placement at the boundary between pericardial cusps and the annulus was a key to CT-based basal ring determination in patients after AVNeo.","['Natsuko Satomi', 'Masaki Miyasaka', 'Yusuke Enta', 'Yoshiko Munehisa', 'Yusuke Toki', 'Masaki Nakashima', 'Makoto Saigan', 'Yuta Kobayashi', 'Yun Teng', 'Manabu Maeda', 'Momo Kosuga', 'Kazuo Abe', 'Masataka Taguri', 'Yukihiro Hayatsu', 'Masaki Hata', 'Norio Tada']",Catheterization and cardiovascular interventions : official journal of the Society for Cardiac Angiography & Interventions,2025-05-14,10.1002/ccd.31583,https://doi.org/10.1002/ccd.31583,,Paid,Transcatheter Aortic Valve Replacement for Structural Valve Deterioration After Aortic Valve Neocuspidization SATOMI 2025,Not available,"['Structural Valve Deterioration', 'Aortic Valve Neocuspidization', 'Aortic Valve Replacement', 'Valve Neocuspidization', 'Structural Valve', 'Valve Deterioration', 'Aortic Valve', 'Transcatheter Aortic Valve', 'Valve', 'Valve Replacement']",2025-05-27,Pending,"['aortic valve neocuspidization', 'coronary obstruction', 'structural valve degeneration', 'transcatheter aortic valve replacement']"
40367359,Impact of Device Type and Orientation on Post-Transcatheter Aortic Valve Replacement Complications in Bicuspid Aortic Valve Patients: A Computational Study.,"Currently, no clinical modality reliably assists clinicians in selecting the optimal transcatheter aortic valve replacement (TAVR) device orientation. This is critical for the growing population of young bicuspid aortic valve (BAV) TAVR candidates, who are at high risk for post-procedural complications. We aim to develop a predictive computational modeling workflow to identify which TAVR device and orientation will minimize the risk of paravalvular leakage (PVL), coronary obstruction, and flow-induced thrombogenicity. We compared the risk of post-TAVR complications across more than 30 device orientation combinations by virtually implanting self-expandable and balloon-expandable TAVR devices in three BAV patients. PVL severity varied significantly with device orientation, reaching up to 22.03 mL/beat with certain self-expandable devices. For self-expandable devices, orientations that ensured the shortest distance between the taller skirt region and PVL regions minimized PVL. A shorter frame height in balloon-expandable devices was insufficient to cover PVL regions in certain patients. Pearson correlation demonstrated a negative relationship between device oversizing and PVL. The risk of flow-induced thrombogenicity was positively correlated with PVL severity. A patient-specific computational modeling workflow can identify the optimal TAVR device and orientation, minimizing life-threatening post-TAVR complications and facilitating future reinterventions for young BAV TAVR candidates.","['Salwa Anam', 'Brandon Kovarovic', 'Puja Parikh', 'Marvin Slepian', 'Ashraf Hamdan', 'Rami Haj-Ali', 'Danny Bluestein']",ASAIO journal (American Society for Artificial Internal Organs : 1992),2025-05-14,10.1097/MAT.0000000000002459,https://doi.org/10.1097/MAT.0000000000002459,,Paid,Impact of Device Type and Orientation on Post Transcatheter Aortic Valve Replacement Complications in Bicuspid Aortic Valve Patients A Computational Study ANAM 2025,Not available,"['Aortic Valve Replacement', 'Bicuspid Aortic Valve', 'Aortic Valve', 'Post-Transcatheter Aortic Valve', 'Aortic Valve Patients', 'Valve Replacement Complications', 'Valve Replacement', 'transcatheter aortic valve', 'Bicuspid Aortic', 'Computational Study']",2025-05-27,Pending,"['TAVR', 'bicuspid aortic valve', 'coronary obstruction', 'digital twin', 'paravalvular leakage', 'predictive computational modeling']"
40348046,Comparative Prognostic Value of Risk Factors for Predicting Pacemaker Implantation After Transcatheter Aortic Valve Replacement: A Systematic Review and Network Meta-Analysis.,"This study compares the prognostic value of risk factors for Permanent pacemaker implantation (PPI) following transcatheter aortic valve replacement (TAVR). PubMed, Embase, Scopus, and Cochrane Library databases were searched until November 2024 for studies reporting PPI incidence within 30 days post-TAVR. A random-effect model was used to pool risk ratios (RR) and standardized mean differences (SDM) for binary and continuous risk factors. Network meta-analysis estimated pooled risk differences (ΔRR) for binary predictors with male sex as the reference. Significant predictors were ranked based on their surface under the cumulative ranking curve (SUCRA) values. A total of 108 studies comprising 77,538 patients (14,560 requiring PPI) were included. Male sex (RR: 1.13), baseline atrial fibrillation (AF) (RR: 1.12), 2nd degree Mobitz I (RR: 5.16) and Mobitz II (RR: 2.30) atrioventricular blocks (AVB), 3rd degree AVB (RR: 13.46), left anterior (LAHB) (RR: 1.79) and posterior hemiblocks (LPHB) (RR: 2.57), bifascicular block (RR: 2.34), right bundle branch block (RBBB) (RR: 3.20) and intraprocedural AVB (RR: 4.15) were identified as predictors for PPI post-TAVR. The risk of PPI was higher with self-expandable valves (RR: 1.79), subclavian access (RR: 1.75), and 29 mm prostheses (RR: 1.33) compared to balloon-expandable valves, transfemoral access, and 23 mm prostheses. Network meta-analysis ranked 3rd degree AVB (SUCRA <0.01), Mobitz I AVB (SUCRA: 0.14), Mobitz II AVB (SUCRA: 0.33), intraprocedural AVB (SUCRA: 0.42), bifascicular block (SUCRA: 0.48), RBBB (SUCRA: 0.49) and LPHB (SUCRA: 0.54) as major predictors of PPI in descending order of significance. In conclusion, clinicians should closely monitor conduction abnormalities as key predictors of PPI following TAVR. Additionally, other risk factors such as subclavian access, self-expanding implantation, AF, large prosthesis diameter, and male sex should not be overlooked.","['Negin Sadat Hosseini Mohammadi', 'Kiarash Tavakoli', 'Morvarid Taebi', 'Ali Zafari', 'Mobina Riahi', 'Mohammad Mahdi Molaei', 'Mashood Ahmad Farooqi', 'Ramtin Khanipour', 'Houshang Bavandpour Karvane', 'Soraya Shahrzad', 'Marmar Vaseghi', 'Ghanunjaya R Lakkirrddy', 'Jishanth Mattumpuram', 'Stylianos Tzeis', 'Yaser Jenab', 'Kaveh Hosseini']",The American journal of cardiology,2025-05-21,10.1016/j.amjcard.2025.05.009,https://doi.org/10.1016/j.amjcard.2025.05.009,,Paid,Comparative Prognostic Value of Risk Factors for Predicting Pacemaker Implantation After Transcatheter Aortic Valve Replacement A Systematic Review and Network Meta analysis MOHAMMADI 2025,Not available,"['Aortic Valve Replacement', 'Predicting Pacemaker Implantation', 'Transcatheter Aortic Valve', 'Systematic Review', 'Permanent pacemaker implantation', 'Predicting Pacemaker', 'Transcatheter Aortic', 'Valve Replacement', 'SUCRA', 'Aortic Valve']",2025-05-27,Pending,"['artificial', 'atrioventricular block', 'cardiac conduction disorders', 'pacemaker', 'risk factors', 'transcatheter aortic valve replacement']"
40334981,Prevalence and clinical outcomes of permanent conduction disturbances after transcatheter aortic valve replacement.,"BACKGROUND: A new-onset conduction disturbance is a major concern in patients undergoing transcatheter aortic valve replacement (TAVR) but can resolve over time. This study aimed to evaluate the recovery in conduction disturbances post-TAVR and its association with clinical outcomes.
METHODS: This retrospective study included 780 TAVR patients at St. Marianna University between January 2016 and March 2023. Patients were stratified into four groups based on conduction status at six months post-TAVR: no conduction disturbance, recovered conduction disturbance [defined as a post-procedural pacemaker implantation with cumulative right ventricular pacing <40 % or complete left bundle branch block (CLBBB) at discharge but not at six months], permanent conduction disturbance (defined as pacemaker implantation with cumulative right ventricular pacing ≥40 % or CLBBB at both discharge and six months), and preprocedural conduction disturbance. The primary outcomes were all-cause mortality and heart failure hospitalization. The secondary outcome was the change in cardiac damage from pre-procedure to one-year post-TAVR.
RESULTS: Of 780 patients, 220 (28 %) had new-onset CLBBB or required a pacemaker implantation at discharge. Among these, 99 (45 %) had permanent conduction disturbances at six months. Over a median follow-up of 788 days, both permanent and preprocedural conduction disturbances were significantly associated with a higher incidence of heart failure hospitalization [hazard ratio (HR) 3.63; 95 % confidence interval (CI): 2.04-6.47, p < 0.01 and HR 2.50; 95 % CI: 1.27-4.90, p < 0.01), although no difference in all-cause mortality was observed. In contrast, the prognosis of patients with recovered conduction disturbance was comparable with those with no conduction disturbance. Patients with permanent and preprocedural conduction disturbances showed significant worsening cardiac damage.
CONCLUSION: Permanent and preprocedural conduction disturbances after TAVR were associated with increased heart failure hospitalizations, while the prognostic impact of recovered conduction disturbance may be limited.","['Takahiko Kai', 'Masaki Izumo', 'Masahiro Sekiguchi', 'Tetsu Tanaka', 'Taishi Okuno', 'Yukio Sato', 'Shingo Kuwata', 'Masashi Koga', 'Ikutaro Nakajima', 'Kenichi Sasaki', 'Yasuhiro Tanabe', 'Tomoo Harada', 'Yoshihiro J Akashi']",Journal of cardiology,2025-05-19,10.1016/j.jjcc.2025.04.013,https://doi.org/10.1016/j.jjcc.2025.04.013,,Paid,Prevalence and clinical outcomes of permanent conduction disturbances after Transcatheter aortic valve replacement KAI 2025,Not available,"['aortic valve replacement', 'transcatheter aortic valve', 'conduction disturbance', 'conduction', 'preprocedural conduction disturbances', 'valve replacement', 'preprocedural conduction', 'recovered conduction disturbance', 'permanent conduction disturbances', 'aortic valve']",2025-05-27,Pending,"['Aortic stenosis', 'Conduction disturbance', 'Transcatheter aortic valve replacement']"
40252070,Valve Dragging Technique in Valve Migration After Self-Expanding Transcatheter Aortic Valve Replacement.,"BACKGROUND: Transcatheter aortic valve replacement (TAVR) may be considered for patients with symptomatic severe aortic regurgitation at high surgical risk.
CASE SUMMARY: This article presents the case of a 74-year-old man who presented with dyspnea and was diagnosed with severe aortic regurgitation. TAVR with a self-expanding valve was performed but complicated with valve migration toward the left ventricle, resulting in severe paravalvular regurgitation. Ultimately, the valve dragging technique was used to reposition the initial valve and a second valve was implanted, achieving satisfactory final outcomes.
DISCUSSION: This technique provides a novel strategy for valve migration after TAVR, avoiding surgical reintervention.
TAKE-HOME MESSAGE: The valve dragging technique is a remedial measure for severe paravalvular regurgitation secondary to valve migration after self-expanding TAVR by dragging with a second valve.","['Yinghao Sun', 'Jie Li', 'Yuan Liu', 'Jianfang Luo']",JACC. Case reports,2025-05-14,10.1016/j.jaccas.2025.103928,https://doi.org/10.1016/j.jaccas.2025.103928,,Paid,Valve Dragging Technique in Valve Migration After Self Expanding Transcatheter Aortic Valve Replacement SUN 2025,Not available,"['Transcatheter Aortic Valve', 'Aortic Valve Replacement', 'Transcatheter Aortic', 'Self-Expanding Transcatheter Aortic', 'Valve Dragging Technique', 'severe aortic regurgitation', 'Valve', 'Valve Replacement', 'Valve Migration', 'Aortic Valve']",2025-05-27,Pending,"['aortic regurgitation', 'self-expanding', 'transcatheter aortic valve replacement', 'valve dragging technique', 'valve migration']"
40252068,Unusual Case of Acute Type A Aortic Dissection During TAVR Bailout With a Self-Expanding Valve.,"BACKGROUND: Over the past 2 decades, transcatheter aortic valve replacement (TAVR) has emerged as a widely accepted treatment for patients with severe aortic valve stenosis. Acute aortic dissection, although rare, is a life-threatening complication associated with TAVR.
CASE SUMMARY: An older man with severe aortic stenosis underwent TAVR. During valve deployment, catheter manipulation caused intimal disruption, leading to acute type A aortic dissection (TAAD). Remarkably, the dissection spontaneously sealed after prosthetic valve placement, thereby avoiding emergency surgery. A 6-month follow-up computed tomography angiography scan showed no extension of the dissection.
DISCUSSION: In the case we report, the dissection spontaneously sealed with the use of a prosthetic valve, a finding that reinforces the feasibility of nonsurgical management of iatrogenic TAAD during TAVR in select cases.
TAKE-HOME MESSAGE: The use of a biological valve offers a novel perspective on the conservative management of iatrogenic aortic dissection in high-risk patients during TAVR.","['Lianyue Ma', 'Yongfeng Liang', 'Wei Gao', 'Mei Dong', 'Xiangjuan Liu', 'Yuan Cao', 'Xiao Meng', 'Guipeng An']",JACC. Case reports,2025-05-14,10.1016/j.jaccas.2025.103919,https://doi.org/10.1016/j.jaccas.2025.103919,,Paid,Unusual Case of Acute Type A Aortic Dissection During TAVR Bailout With a Self Expanding Valve MA 2025,Not available,"['TAVR Bailout', 'Aortic Dissection', 'TAVR', 'Aortic', 'Dissection', 'Acute aortic dissection', 'Acute Type', 'Valve', 'Bailout', 'severe aortic']",2025-05-27,Pending,"['TAVR', 'transcatheter heart valve', 'type A aortic dissection']"
40252066,Managing Cardiogenic Shock With Concurrent Transcatheter Aortic Valve Replacement and Percutaneous Coronary Intervention.,"BACKGROUND: Cardiogenic shock secondary to concomitant severe aortic stenosis (AS) and coronary artery disease (CAD) is a critical clinical condition requiring comprehensive management.
CASE SUMMARY: A 75-year-old man presented with cardiogenic shock resulting from severe AS and CAD. Emergency surgery was performed. It involved initiation of extracorporeal circulatory support, followed by percutaneous coronary intervention (PCI) and, subsequently, transcatheter aortic valve replacement (TAVR) using a TaurusElite valve (Peijia Medical). This strategy resulted in marked hemodynamic improvement.
DISCUSSION: This case highlights the efficacy and safety of concurrent PCI and TAVR as a lifesaving strategy for cardiogenic shock patients with concomitant severe CAD and AS.
TAKE-HOME MESSAGES: Emergency PCI with concurrent TAVR represents a viable lifesaving strategy for cardiogenic shock patients with coexisting severe CAD and AS. Prophylactic extracorporeal circulation initiation is critical in TAVR procedures for patients with cardiogenic shock to prevent circulatory collapse and maintain systemic perfusion.","['Tong Tan', 'Enjun Zhu', 'Hao Cui', 'Yongqiang Lai']",JACC. Case reports,2025-05-14,10.1016/j.jaccas.2025.103918,https://doi.org/10.1016/j.jaccas.2025.103918,,Paid,Managing Cardiogenic Shock With Concurrent Transcatheter Aortic Valve Replacement and Percutaneous Coronary Intervention TAN 2025,Not available,"['Percutaneous Coronary Intervention', 'Transcatheter Aortic Valve', 'Aortic Valve Replacement', 'Cardiogenic Shock', 'Managing Cardiogenic Shock', 'Coronary Intervention', 'cardiogenic shock patients', 'Aortic Valve', 'Transcatheter Aortic', 'Percutaneous Coronary']",2025-05-27,Pending,"['bicuspid aortic valve', 'cardiovascular disease', 'percutaneous coronary intervention']"
40252065,Procedural Strategies in Transcatheter Aortic Valve Replacement for Patients With Small Aortic Annulus and Aortic Stenosis.,"Small aortic annulus is recognized as a critical risk factor in transcatheter aortic valve replacement, predisposing patients to prosthesis-patient mismatch. This case series examines 3 distinct anatomical subtypes of small aortic annulus patients undergoing transcatheter aortic valve replacement: 1) tricuspid aortic valve morphology; 2) type 0 bicuspid aortic valve; and 3) failed surgical bioprosthesis. The analysis highlights subtype-specific technical challenges and procedural optimization strategies, emphasizing the importance of preprocedural imaging and prosthesis selection in mitigating complications.","['Changfu Liu', 'Zeyu Sun', 'Yingqian Zhang', 'Yang Mu', 'Dongkai Shan', 'Bo Jiang', 'Jing Wang', 'Yundai Chen']",JACC. Case reports,2025-05-14,10.1016/j.jaccas.2025.103929,https://doi.org/10.1016/j.jaccas.2025.103929,,Paid,Procedural Strategies in Transcatheter Aortic Valve Replacement for Patients With Small Aortic Annulus and Aortic Stenosis LIU 2025,Not available,"['Transcatheter Aortic Valve', 'Aortic Valve Replacement', 'Small Aortic Annulus', 'Aortic Valve', 'aortic annulus patients', 'Aortic Stenosis', 'Transcatheter Aortic', 'Small Aortic', 'Aortic Annulus', 'Valve Replacement']",2025-05-27,Pending,"['aortic stenosis', 'small aortic annulus', 'transcatheter aortic valve replacement']"
40252063,One-Stop TEVAR and TAVR Procedure for Severe Aortic Stenosis With Aortic Arch Aneurysm.,"BACKGROUND: In recent years, transcatheter aortic valve replacement (TAVR) has become the fundamental treatment for patients with aortic stenosis (AS). Thoracic endovascular aortic repair (TEVAR) is also recommended for penetrating aortic ulcer. Especially in older patients with severe AS and penetrating aortic ulcer at the same time, the surgical method brings significant risk.
CASE SUMMARY: We report a case of a 74-year-old male patient who presented with a 10-day history of dyspnea. He was diagnosed with severe AS with aortic valve insufficiency (penetrating aortic ulcer) and had multiple comorbidities. The patient underwent a 1-stop TEVAR + TAVR procedure.
DISCUSSION: The challenge was compounded by the patient's extremely narrow femoral access. This case demonstrates the 2 operations can be performed as a procedure.
TAKE-HOME MESSAGES: Management of patients with severe AS and concurrent aortic pathology is complicated. One-stop TEVAR + TAVR procedure is viable and beneficial in such patients.","['Cheng Tan', 'Jia Yi Weng', 'Zhong Shan Gou', 'Hai Feng Zhang', 'Jun Zhang']",JACC. Case reports,2025-05-14,10.1016/j.jaccas.2025.103922,https://doi.org/10.1016/j.jaccas.2025.103922,,Paid,One Stop TEVAR and TAVR Procedure for Severe Aortic Stenosis With Aortic Arch Aneurysm TAN 2025,Not available,"['Aortic Arch Aneurysm', 'Arch Aneurysm', 'Aortic Arch', 'Severe Aortic Stenosis', 'Aortic', 'Aortic Stenosis', 'penetrating aortic ulcer', 'TAVR Procedure', 'penetrating aortic', 'aortic ulcer']",2025-05-27,Pending,"['aortic valve', 'cardiovascular disease', 'stenosis', 'valve replacement']"
